{"schema_version":"hak.check-evidence-binding-policy.v1","policy_id":"hak011-real-provider-evidence-binding-policy-v1","qualification_plan":{"plan_id":"hak011-real-provider-evidence-integration-e5-v1","plan_digest":"sha256:97f8fbb61d5951129d9a45c573ee222f46483652ff02be3b64a6afc69c0be387"},"workflow_path":".github/workflows/hak-real-evidence.yml","bindings":[{"obligation_kind":"RequiredCheck","obligation_id":"exact-head","job_name":"HAK Real Provider Evidence","step_name":"Assert exact-head checkout","step_number":3,"accepted_job_conclusions":["success"],"accepted_step_conclusions":["success"]},{"obligation_kind":"RequiredCheck","obligation_id":"compile","job_name":"HAK Real Provider Evidence","step_name":"Compile HAK real-evidence tooling","step_number":6,"accepted_job_conclusions":["success"],"accepted_step_conclusions":["success"]},{"obligation_kind":"RequiredCheck","obligation_id":"schema-validation","job_name":"HAK Real Provider Evidence","step_name":"Validate HAK-011 schema syntax","step_number":7,"accepted_job_conclusions":["success"],"accepted_step_conclusions":["success"]},{"obligation_kind":"RequiredCheck","obligation_id":"plan-lint","job_name":"HAK Real Provider Evidence","step_name":"Lint HAK-011 qualification plan","step_number":8,"accepted_job_conclusions":["success"],"accepted_step_conclusions":["success"]},{"obligation_kind":"RequiredCheck","obligation_id":"policy-lint","job_name":"HAK Real Provider Evidence","step_name":"Lint HAK-011 check-binding policy","step_number":9,"accepted_job_conclusions":["success"],"accepted_step_conclusions":["success"]},{"obligation_kind":"RequiredCheck","obligation_id":"capsule-validation","job_name":"HAK Real Provider Evidence","step_name":"Validate real cancelled-run evidence capsule","step_number":10,"accepted_job_conclusions":["success"],"accepted_step_conclusions":["success"]},{"obligation_kind":"RequiredCheck","obligation_id":"regressions","job_name":"HAK Real Provider Evidence","step_name":"Run HAK-011 regressions","step_number":11,"accepted_job_conclusions":["success"],"accepted_step_conclusions":["success"]},{"obligation_kind":"NegativeCase","obligation_id":"real receipt subject mismatch","job_name":"HAK Real Provider Evidence","step_name":"Run HAK-011 regressions","step_number":11,"accepted_job_conclusions":["success"],"accepted_step_conclusions":["success"]},{"obligation_kind":"NegativeCase","obligation_id":"real receipt run-attempt mismatch","job_name":"HAK Real Provider Evidence","step_name":"Run HAK-011 regressions","step_number":11,"accepted_job_conclusions":["success"],"accepted_step_conclusions":["success"]},{"obligation_kind":"NegativeCase","obligation_id":"real receipt terminal-job mismatch","job_name":"HAK Real Provider Evidence","step_name":"Run HAK-011 regressions","step_number":11,"accepted_job_conclusions":["success"],"accepted_step_conclusions":["success"]},{"obligation_kind":"NegativeCase","obligation_id":"provider job timestamp mismatch","job_name":"HAK Real Provider Evidence","step_name":"Run HAK-011 regressions","step_number":11,"accepted_job_conclusions":["success"],"accepted_step_conclusions":["success"]},{"obligation_kind":"NegativeCase","obligation_id":"cancelled no-step run marked Satisfied","job_name":"HAK Real Provider Evidence","step_name":"Run HAK-011 regressions","step_number":11,"accepted_job_conclusions":["success"],"accepted_step_conclusions":["success"]},{"obligation_kind":"NegativeCase","obligation_id":"cancelled no-step run contains Passed obligation","job_name":"HAK Real Provider Evidence","step_name":"Run HAK-011 regressions","step_number":11,"accepted_job_conclusions":["success"],"accepted_step_conclusions":["success"]},{"obligation_kind":"NegativeCase","obligation_id":"cancelled no-step run fabricates provider check evidence","job_name":"HAK Real Provider Evidence","step_name":"Run HAK-011 regressions","step_number":11,"accepted_job_conclusions":["success"],"accepted_step_conclusions":["success"]},{"obligation_kind":"NegativeCase","obligation_id":"cancelled no-step claim marked Qualified","job_name":"HAK Real Provider Evidence","step_name":"Run HAK-011 regressions","step_number":11,"accepted_job_conclusions":["success"],"accepted_step_conclusions":["success"]},{"obligation_kind":"NegativeCase","obligation_id":"cancelled no-step claim marked NotSatisfied","job_name":"HAK Real Provider Evidence","step_name":"Run HAK-011 regressions","step_number":11,"accepted_job_conclusions":["success"],"accepted_step_conclusions":["success"]},{"obligation_kind":"NegativeCase","obligation_id":"real evidence capsule receipt digest mismatch","job_name":"HAK Real Provider Evidence","step_name":"Run HAK-011 regressions","step_number":11,"accepted_job_conclusions":["success"],"accepted_step_conclusions":["success"]},{"obligation_kind":"NegativeCase","obligation_id":"real evidence capsule conformance digest mismatch","job_name":"HAK Real Provider Evidence","step_name":"Run HAK-011 regressions","step_number":11,"accepted_job_conclusions":["success"],"accepted_step_conclusions":["success"]},{"obligation_kind":"NegativeCase","obligation_id":"real evidence capsule interpretation digest mismatch","job_name":"HAK Real Provider Evidence","step_name":"Run HAK-011 regressions","step_number":11,"accepted_job_conclusions":["success"],"accepted_step_conclusions":["success"]},{"obligation_kind":"NegativeCase","obligation_id":"real evidence capsule digest tampering","job_name":"HAK Real Provider Evidence","step_name":"Run HAK-011 regressions","step_number":11,"accepted_job_conclusions":["success"],"accepted_step_conclusions":["success"]},{"obligation_kind":"NegativeCase","obligation_id":"schema accepts nonempty provider_check_evidence for no-step fixture","job_name":"HAK Real Provider Evidence","step_name":"Run HAK-011 regressions","step_number":11,"accepted_job_conclusions":["success"],"accepted_step_conclusions":["success"]}],"policy_digest":"sha256:77bf063a0813e3baa2d65da81e8b39e18160c21320c9b47a6c89e4fb39d05656"}